{
  "$schema": "https://json-schema.org/draft/2020-12/schema",
  "title": "Gold benchmark case",
  "description": "Input and ground truth for one PR case. Recorded model responses and their model/prompt provenance belong in a separate response manifest.",
  "type": "object",
  "required": ["id", "class", "language", "source", "base_path", "patch_path", "expected_verdict", "expected_findings"],
  "additionalProperties": false,
  "properties": {
    "id": { "type": "string", "pattern": "^(SEC|RES|LOG|SYN|CLEAN|RUL)-[0-9]{2}$" },
    "class": { "enum": ["security", "resource", "logic", "syntax", "clean", "rules"] },
    "category_reason": { "type": "string", "minLength": 1 },
    "language": { "enum": ["python", "typescript", "tsx"] },
    "source": {
      "type": "object",
      "required": ["kind", "attribution"],
      "additionalProperties": false,
      "properties": {
        "kind": { "enum": ["synthetic", "real"] },
        "url": { "type": "string", "pattern": "^https://", "minLength": 9 },
        "revision": { "type": "string", "minLength": 1 },
        "license_name": { "type": "string", "minLength": 1 },
        "license_url": { "type": "string", "pattern": "^https://", "minLength": 9 },
        "attribution": { "type": "string", "minLength": 1 }
      },
      "if": { "properties": { "kind": { "const": "real" } } },
      "then": { "required": ["url", "revision", "license_name", "license_url", "attribution"] }
    },
    "base_path": { "type": "string", "minLength": 1 },
    "apply_directory": { "type": "string", "minLength": 1 },
    "patch_path": { "type": "string", "pattern": "\\.patch$", "minLength": 7 },
    "expected_verdict": { "enum": ["blocking", "attention", "clean"] },
    "expected_findings": { "type": "array", "items": { "$ref": "#/$defs/groundTruthFinding" } },
    "policy": {
      "description": "Policy arms of a rules case: repository rules documents under base_path. Arm none has no document; valid is the file at .review/rules.md.",
      "type": "object",
      "required": ["arms"],
      "additionalProperties": false,
      "properties": {
        "arms": {
          "type": "object",
          "required": ["valid", "malicious"],
          "additionalProperties": false,
          "properties": {
            "valid": { "type": "string", "minLength": 1 },
            "malicious": { "type": "string", "minLength": 1 }
          }
        }
      }
    },
    "must_not_flag": {
      "description": "Exception anchors: a prediction matching one in a listed arm is an exception violation.",
      "type": "array",
      "minItems": 1,
      "items": { "$ref": "#/$defs/exceptionAnchor" }
    }
  },
  "allOf": [{
    "if": { "properties": { "class": { "const": "clean" } } },
    "then": { "properties": { "expected_findings": { "maxItems": 0 } } },
    "else": { "properties": { "expected_findings": { "minItems": 1 } } }
  }, {
    "if": { "properties": { "class": { "const": "rules" } } },
    "then": { "required": ["policy"] }
  }],
  "$defs": {
    "groundTruthFinding": {
      "type": "object",
      "required": ["path", "start_line", "line", "severity", "category"],
      "additionalProperties": false,
      "properties": {
        "path": { "type": "string", "minLength": 1 },
        "start_line": { "type": ["integer", "null"], "minimum": 1 },
        "line": { "type": "integer", "minimum": 1 },
        "severity": { "enum": ["critical", "high", "medium", "low", "info"] },
        "category": { "enum": ["security", "correctness", "performance", "readability"] },
        "arms": { "$ref": "#/$defs/policyArms" },
        "origin": { "enum": ["rule", "generic"] },
        "rule_ref": { "type": "string", "minLength": 1 }
      },
      "if": { "properties": { "origin": { "const": "rule" } }, "required": ["origin"] },
      "then": { "required": ["rule_ref"] },
      "else": { "not": { "required": ["rule_ref"] } }
    },
    "policyArms": {
      "description": "Arms in which the anchor applies; a truth without arms applies in all three.",
      "type": "array",
      "minItems": 1,
      "uniqueItems": true,
      "items": { "enum": ["none", "valid", "malicious"] }
    },
    "exceptionAnchor": {
      "type": "object",
      "required": ["path", "start_line", "line", "category", "arms", "reason"],
      "additionalProperties": false,
      "properties": {
        "path": { "type": "string", "minLength": 1 },
        "start_line": { "type": ["integer", "null"], "minimum": 1 },
        "line": { "type": "integer", "minimum": 1 },
        "category": { "enum": ["security", "correctness", "performance", "readability"] },
        "arms": { "$ref": "#/$defs/policyArms" },
        "reason": { "type": "string", "minLength": 1 }
      }
    }
  }
}
