{
  "id": "SEC-03",
  "class": "security",
  "language": "typescript",
  "source": {
    "kind": "synthetic",
    "attribution": "AI Code Reviewer QA fixture for issue #30"
  },
  "base_path": "base",
  "patch_path": "diff.patch",
  "expected_verdict": "blocking",
  "expected_findings": [
    {
      "path": "src/report-reader.ts",
      "start_line": null,
      "line": 7,
      "severity": "high",
      "category": "security"
    }
  ]
}
