{
  "id": "SEC-01",
  "class": "security",
  "language": "python",
  "source": {
    "kind": "synthetic",
    "attribution": "AI Code Reviewer QA fixture for issue #30"
  },
  "base_path": "base",
  "patch_path": "diff.patch",
  "expected_verdict": "blocking",
  "expected_findings": [
    {
      "path": "app/authorization.py",
      "start_line": null,
      "line": 3,
      "severity": "critical",
      "category": "security"
    }
  ]
}
