{
  "id": "SYN-01",
  "class": "syntax",
  "language": "python",
  "source": {
    "kind": "synthetic",
    "attribution": "AI Code Reviewer QA fixture for issue #30"
  },
  "base_path": "base",
  "patch_path": "diff.patch",
  "expected_verdict": "attention",
  "expected_findings": [
    {
      "path": "ci/checks.py",
      "start_line": null,
      "line": 7,
      "severity": "low",
      "category": "readability"
    }
  ]
}
