{
  "id": "RES-05",
  "class": "resource",
  "language": "python",
  "source": {
    "kind": "synthetic",
    "attribution": "AI Code Reviewer QA fixture for issue #30"
  },
  "base_path": "base",
  "patch_path": "diff.patch",
  "expected_verdict": "blocking",
  "expected_findings": [
    {
      "path": "services/settlement_worker.py",
      "start_line": null,
      "line": 15,
      "severity": "critical",
      "category": "performance"
    }
  ]
}
