{
  "id": "LOG-04",
  "class": "logic",
  "language": "tsx",
  "source": {
    "kind": "synthetic",
    "attribution": "AI Code Reviewer QA fixture for issue #30"
  },
  "base_path": "base",
  "patch_path": "diff.patch",
  "expected_verdict": "attention",
  "expected_findings": [
    {
      "path": "src/features/reviews/model/useReviewRun.tsx",
      "start_line": null,
      "line": 32,
      "severity": "medium",
      "category": "correctness"
    }
  ]
}
