{
  "id": "RES-02",
  "class": "resource",
  "language": "tsx",
  "source": {
    "kind": "synthetic",
    "attribution": "AI Code Reviewer QA fixture for issue #30"
  },
  "base_path": "base",
  "patch_path": "diff.patch",
  "expected_verdict": "attention",
  "expected_findings": [
    {
      "path": "src/useNotifications.tsx",
      "start_line": null,
      "line": 14,
      "severity": "medium",
      "category": "performance"
    }
  ]
}
