{
  "id": "LOG-02",
  "class": "logic",
  "language": "typescript",
  "source": {
    "kind": "synthetic",
    "attribution": "AI Code Reviewer QA fixture for issue #30"
  },
  "base_path": "base",
  "patch_path": "diff.patch",
  "expected_verdict": "blocking",
  "expected_findings": [
    {
      "path": "src/checkout/settlement.ts",
      "start_line": null,
      "line": 14,
      "severity": "critical",
      "category": "correctness"
    }
  ]
}
